{
    "$schema": "../../schemas/stable/mxc-config.schema.0.9.0-alpha.json",
    "version": "0.9.0-alpha",
    "phase": "exec",
    "sandboxId": "{{SANDBOX_ID}}",
    "process": {
        "commandLine": "echo MY_SA_VAR=$MY_SA_VAR",
        "env": ["MY_SA_VAR=state-aware-env-value"],
        "timeout": 30000
    }
}
