{
    "$schema": "../../schemas/stable/mxc-config.schema.0.9.0-alpha.json",
    "version": "0.9.0-alpha",
    "phase": "exec",
    "sandboxId": "{{SANDBOX_ID}}",
    "process": {
        "commandLine": "sh -c 'echo wslc-warm-marker-content > /tmp/wslc_sa_marker; echo wrote'",
        "timeout": 30000
    }
}
