{
  "version": "0.5.0-alpha",
  "containerId": "isolation-session-hello-medium",
  "containment": "isolation_session",
  "process": {
    "commandLine": "echo USERNAME=%USERNAME% & echo MYVAR=%MYVAR% & echo CWD=%CD% & whoami",
    "cwd": "C:\\mxc_workdir_test",
    "env": ["MYVAR=IsolationSessionTest"],
    "timeout": 30000
  },
  "experimental": {
    "isolation_session": {
      "configurationId": "medium"
    }
  }
}
